name,slug,meta_title,meta_description
Cups & Lids,cups-and-lids,Cups & Lids - Hot & Cold Drink Cups | Afida,"Premium hot and cold cups with lids. Paper coffee cups, recyclable cold drink cups, and sustainable beverage solutions for your business."
Ice Cream Cups,ice-cream-cups,Ice Cream Cups - Disposable Paper Cups | Afida,"Sustainable packaging for ice cream, desserts, and frozen treats. Eco-friendly paper cups."
Napkins,napkins,Napkins - Dinner & Cocktail Napkins | Afida,"Quality napkins for dining and events. Paper, airlaid, and bamboo options available."
Pizza Boxes,pizza-boxes,Pizza Boxes - Kraft Packaging | Afida,"Eco-friendly pizza boxes in various sizes. Durable kraft packaging for takeaway pizzerias."
Straws,straws,Eco Straws - Bamboo & Bio Fibre | Afida,"Sustainable straws made from bamboo pulp and bio fibre. Biodegradable alternatives to plastic."
Takeaway Containers,takeaway-containers,Takeaway Containers - Food Packaging | Afida,"Eco-friendly food containers, bowls, and deli boxes for takeaway. Sustainable kraft packaging."
Takeaway Extras,takeaway-extras,Takeaway Accessories - Bags & Cutlery | Afida,"Complete your takeaway service with bags, wooden cutlery, and packaging accessories."
